{
  "schemaVersion": 1,
  "slug": "two_sum",
  "mode": "statement+idea",
  "source": {
    "kind": "plain-text",
    "path": "source/problem.txt",
    "sha256": null,
    "rawText": "Compute the sum of two integers.",
    "extraction": "manual",
    "reviewStatus": "verified",
    "attribution": null
  },
  "statement": {
    "title": "Two Sum",
    "language": "en",
    "legend": "Find the sum of a and b.",
    "input": "The input contains two integers a and b.",
    "output": "Output their sum.",
    "notes": null,
    "interactive": false,
    "constraints": [
      {
        "expression": "-10^9 <= a, b <= 10^9",
        "scope": "per-file",
        "sourceExcerpt": "-10^9 <= a, b <= 10^9"
      }
    ],
    "samples": [
      {
        "input": "2 3\n",
        "output": "5\n",
        "explanation": null
      }
    ],
    "testCaseMode": "single",
    "outputPolicy": "exact",
    "timeLimitMs": 1000,
    "memoryLimitMb": 256
  },
  "guidance": {
    "idea": {
      "text": "Read two integers and add them using a 64-bit type.",
      "providedBy": "user"
    }
  },
  "ambiguities": []
}
