{
  "schemaVersion": 1,
  "slug": "two_sum",
  "mode": "statement-only",
  "source": {
    "kind": "plain-text",
    "path": "source/problem.txt",
    "sha256": null,
    "rawText": "Compute the sum of two integers.",
    "extraction": "manual",
    "reviewStatus": "pending",
    "attribution": null
  },
  "statement": {
    "title": "Two Sum",
    "language": "en",
    "legend": "Find the sum of a and b.",
    "input": null,
    "output": null,
    "notes": null,
    "interactive": false,
    "constraints": [],
    "samples": [],
    "testCaseMode": "unknown",
    "outputPolicy": "unknown",
    "timeLimitMs": null,
    "memoryLimitMb": null
  },
  "guidance": {},
  "ambiguities": [
    {
      "field": "statement.input",
      "issue": "Input format is missing from the source.",
      "severity": "blocking",
      "sourceExcerpt": null
    }
  ]
}
